{
  "exam_date": "2025-06",
  "label": "יוני 2025",
  "part": "C",
  "part_name": "דין מהותי",
  "questions": [
    {
      "stable_id": "2025-06_C_001",
      "number": 1,
      "status": "active",
      "body": "בהתאם לסעיף 77 לחוק העונשין, מהו סכום הפיצויים המרבי הכללי שניתן להשית?",
      "options": {
        "א": "סכום התקרה הסטטוטורי הקבוע בסעיף בעבור כל ניזוק ישיר מהעבירה בלבד.",
        "ב": "סכום התקרה הסטטוטורי הקבוע בסעיף בעבור כל אחד מהניזוקים מהעבירה, במישרין או\nבעקיפין.",
        "ג": "סכום התקרה הסטטוטורי הקבוע בסעיף בעבור כל ניזוק ישיר מהעבירה, ונוסף על כך סכום\nהתקרה הסטטוטורי הקבוע בסעיף פעם אחת עבור כל הניזוקים העקיפים מהעבירה שהם בני\nמשפחה מדרגה ראשונה של הקורבן יחד.",
        "ד": "סכום התקרה הסטטוטורי הקבוע בסעיף בעבור כל ניזוק ישיר מהעבירה, ונוסף על כך סכום\nהתקרה הסטטוטורי הקבוע בסעיף בעבור כל אחד מהניזוקים העקיפים מהעבירה שהם בני\nמשפחה מדרגה ראשונה של הקורבן."
      },
      "correct_answer": "ג",
      "reference": "סעיף 77 לחוק העונשין, התשל\"ז1977-; דנ\"פ 5625/16 אסרף נ 'טווק",
      "invalidation_note": null
    },
    {
      "stable_id": "2025-06_C_002",
      "number": 2,
      "status": "active",
      "body": "דני פרסם תמונה אינטימית של שרון בשנת .2021 בשבוע שעבר הגישה שרון תביעה נגד דני בגין\nהפרסום. בתביעתה היא טענה שהפרסום הפר את פרטיותה ומהווה פרסום לשון הרע. דני הגיש\nבקשה לסילוק התביעה על הסף מחמת התיישנות.\nמה דין הבקשה?",
      "options": {
        "א": "הבקשה תתקבל – התביעה אכן התיישנה אף שלא חלפו 7 שנים.",
        "ב": "הבקשה תתקבל בחלקה – העילה מכוח חוק הגנת הפרטיות התיישנה, אך העילה מכוח חוק\nאיסור לשון הרע לא התיישנה.",
        "ג": "הבקשה תתקבל בחלקה – העילה מכוח חוק איסור לשון הרע התיישנה, אך העילה מכוח חוק\nהגנת הפרטיות לא התיישנה.",
        "ד": "הבקשה תידחה – התביעה לא התיישנה כי לא חלפו 7 שנים."
      },
      "correct_answer": "ב",
      "reference": "סעיף 5 לחוק ההתיישנות, התשי\"ח1958-; סעיף 26 לחוק הגנת הפרטיות, התשמ\"א1981-",
      "invalidation_note": null
    },
    {
      "stable_id": "2025-06_C_003",
      "number": 3,
      "status": "active",
      "body": "יאיר לווה כספים מנתנאל. הוריו של יאיר חתמו על כתב ערבות לחובותיו של יאיר. יאיר מעוניין\nלהמחות לאברהם את חובו לנתנאל.\nמה הדין?",
      "options": {
        "א": "לא ניתן להמחות חבות אשר מובטחת בערבות.",
        "ב": "ניתן להמחות חבות אשר מובטחת בערבות, הערבות עוברת יחד עם החוב.",
        "ג": "ניתן להמחות חבות אשר מובטחת בערבות, הערבות תהיה תקפה רק אם ניתנה הסכמת הוריו של\nיאיר להמחאה.",
        "ד": "לא ניתן להמחות חבות אשר מובטחת בערבות אלא אם בגוף הסכם הערבות כתוב במפורש כי\nניתן להמחות את החבות."
      },
      "correct_answer": "ג",
      "reference": "סעיפים ,6 8 לחוק המחאת חיובים, התשכ\"ט1969-",
      "invalidation_note": null
    },
    {
      "stable_id": "2025-06_C_004",
      "number": 4,
      "status": "active",
      "body": "עמותה שמטרתה הוגדרה \"לפעול להשגת הנחות עבור פועלי הבניין\" מבקשת לשנות את מטרתה\nל\"לפעול לרווחת פועלי הבניין\".\nמה הדין?",
      "options": {
        "א": "לא ניתן לשנות את מטרות העמותה. אם מבקשים לעשות זאת יש לפתוח עמותת בת עם מטרות\nשונות.",
        "ב": "על העמותה לקבל החלטה על שינוי המטרה באסיפה כללית שנערכה כדין. על ההחלטה לקבל את\nאישור רשם העמותות ובית המשפט.",
        "ג": "על ועד העמותה לקבל החלטה על שינוי המטרה בישיבה שנערכה כדין. על ההחלטה לקבל את\nאישור רשם העמותות ובית המשפט.",
        "ד": "על העמותה לקבל החלטה על שינוי המטרה באסיפה כללית שנערכה כדין. רשם העמותות יאשר\nאת ההחלטה או יעבירנה לאישור בית המשפט."
      },
      "correct_answer": "ד",
      "reference": "סעיף 11 לחוק העמותות, התש\"ם1980-",
      "invalidation_note": null
    },
    {
      "stable_id": "2025-06_C_005",
      "number": 5,
      "status": "active",
      "body": "על הירושה של מייגן חל הדין הקנדי שמפנה לדין הצרפתי.\nאיזה דין יחיל בית המשפט בישראל?",
      "options": {
        "א": "הדין הצרפתי.",
        "ב": "הדין הקנדי.",
        "ג": "הדין הקנדי והדין הצרפתי, לפי העניין.",
        "ד": "הדין הפנימי הישראלי."
      },
      "correct_answer": "ב",
      "reference": "סעיף 142 לחוק הירושה, התשכ\"ה1965-",
      "invalidation_note": null
    },
    {
      "stable_id": "2025-06_C_006",
      "number": 6,
      "status": "active",
      "body": "יוני ושון הם הבעלים המשותפים של חלקת קרקע בעיר חדרה (להלן: \"הקרקע\"). בעת רכישת\nהקרקע, ביום ,1.1.2022 חתמו השניים על הסכם שיתוף שלפיו במהלך 4 השנים הקרובות (קרי עד\nליום 1.1.2026), אף שותף לא יוכל לעשות עסקה בחלקו או לדרוש את פירוק השיתוף בקרקע. כעבור\n3 שנים ועקב קשיים כלכליים שאליהם נקלע יוני, החליט יוני להגיש תביעה לפירוק השיתוף בקרקע.\nשון מתנגד.\nמה הדין?",
      "options": {
        "א": "בית המשפט ייענה לדרישתו של יוני היות שכל שותף רשאי בכל עת לדרוש את פירוק השיתוף.",
        "ב": "בית המשפט לא ייענה לדרישתו של יוני עקב הסכם השיתוף שנחתם המגביל את אפשרות פירוק\nהשיתוף.",
        "ג": "בית המשפט ייענה לדרישתו של יוני היות שהסכם השיתוף לא נרשם בטאבו.",
        "ד": "בית המשפט ייענה לדרישתו של יוני אם ייראה לו שהדבר צודק בנסיבות העניין."
      },
      "correct_answer": "ד",
      "reference": "סעיף 37 לחוק המקרקעין, התשכ\"ט1969-",
      "invalidation_note": null
    },
    {
      "stable_id": "2025-06_C_007",
      "number": 7,
      "status": "active",
      "body": "על מיכל הוטל עונש מאסר על תנאי בגין עבירת עוון בשנת ,2015 והתנאי בר הפעלה החל בשנת .2016\nנכון ליום הבחינה, מה הדין לעניין התיישנות עונש המאסר על תנאי?",
      "options": {
        "א": "עונש מאסר על תנאי אינו מתיישן.",
        "ב": "עונש המאסר על תנאי התיישן בשנת .2018",
        "ג": "עונש המאסר על תנאי התיישן בשנת .2023",
        "ד": "עונש המאסר על תנאי טרם התיישן."
      },
      "correct_answer": "ד",
      "reference": "סעיף 10 לחוק סדר הדין הפלילי [נוסח משולב], התשמ\"ב1982-; רע\"פ 1553/15 ח'ליל דיב עיסא נ 'הועדה המקומית לתכנון ובניה \"השומרון\"",
      "invalidation_note": null
    },
    {
      "stable_id": "2025-06_C_008",
      "number": 8,
      "status": "active",
      "body": "יואב מסרב לשלם מזונות לגרושתו כרמית, ובשל כך הוטל עליו מאסר אזרחי של 10 ימים. 3 שעות\nלאחר מכן הוטל עליו (בתיק אחר) מאסר פלילי של 10 ימים בגין סירוב לשלם קנס שהוטל עליו. יואב\nהועבר מבית המשפט לבית הסוהר.\nמתי ישוחרר יואב ממאסרו?",
      "options": {
        "א": "בתום 20 הימים. תחילה ירצה יואב את המאסר האזרחי ולאחריו את הפלילי.",
        "ב": "בתום 20 הימים. תחילה ירצה יואב את המאסר הפלילי ולאחריו את המאסר האזרחי.",
        "ג": "בתום 10 ימים היות שהמאסר הפלילי והמאסר האזרחי ירוצו באופן חופף.",
        "ד": "בתום 10 ימים ישתחרר יואב מהמאסר הפלילי, ולאחר הפסקה של 15 ימים יתחיל לרצות את\nהמאסר האזרחי במשך 10 ימים, ובסיומם ישתחרר."
      },
      "correct_answer": "א",
      "reference": "סעיף 47 לחוק העונשין, התשל\"ז.1977-",
      "invalidation_note": null
    },
    {
      "stable_id": "2025-06_C_009",
      "number": 9,
      "status": "active",
      "body": "אהובה מתגוררת בבית משותף שבו מתגוררים 9 דיירים. גג הבניין הוא חלק מהרכוש המשותף ואינו\nמוצמד לדירתו של אף אחד מן השכנים. הגג ריק כבר 10 שנים, ויש בו מקום להתקנת 6 דודי שמש.\nאהובה מבקשת להתקין דוד שמש וקיבלה את הסכמת כל השכנים להתקנה, למעט ראובן, אשר אמר\nלאהובה כי הוא אינו מעוניין בפיצוי כספי ויסכים להתקנת הדוד רק אם בתה של אהובה תסכים\nלנהל עימו קשר רומנטי. הניחו כי אין הוראה בתקנון הבית המשותף ביחס לגג.\nמה הדין?",
      "options": {
        "א": "לצורך התקנת דוד שמש מספיקה הסכמת שני שלישים מהדיירים שברשותם שלושה רבעים\nמהרכוש המשותף. לפיכך אהובה יכולה להתקין את הדוד ללא הסכמת ראובן.",
        "ב": "לצורך התקנת דוד שמש מספיקה הסכמה של רוב הדיירים בבניין אשר שלושה רבעים מהרכוש\nהמשותף צמוד לדירותיהם, ולפיכך אין צורך בהסכמת ראובן.",
        "ג": "אהובה מחויבת לקבל את הסכמתו של ראובן. באפשרותה לפנות למפקח על הבתים המשותפים\nאשר רשאי יהיה להרשות את התקנת דוד השמש.",
        "ד": "אהובה מחויבת לקבל את הסכמתו של ראובן. באפשרותה להגיש תביעה נגד ראובן לבית משפט\nהשלום שבתחומו מצויים המקרקעין בדרישה לחייב את ראובן להרשות את התקנת דוד השמש."
      },
      "correct_answer": "ג",
      "reference": "סעיף 59א לחוק המקרקעין, התשכ\"ט1969-",
      "invalidation_note": null
    },
    {
      "stable_id": "2025-06_C_010",
      "number": 10,
      "status": "active",
      "body": "עורך דין שעבר באקראי ברכבו בסמוך להפגנה שעסקה במדיניות הממשלה בנושאים כלכליים,\nהתבטא בסגנון חריף של גינוי נגד המפגינים שהיו מן הצד השני של המפה הפוליטית. אחת המפגינות\nזיהתה אותו, וביודעה שהוא עורך דין הגישה נגדו תלונה לוועדת האתיקה.\nמה הדין?",
      "options": {
        "א": "מאחר שאין זיקה בין התוכן והנושא של ההתבטאות ובין עבודתו המקצועית של הנילון כעורך\nדין אין עילה לבירור משמעתי נגדו.",
        "ב": "מאחר שמדובר בהתבטאות שנעשתה על ידי עורך הדין כאדם מן הציבור ולא במסגרת שעות\nעבודתו כעורך דין, אין לוועדת האתיקה סמכות לפתוח בבירור משמעתי נגד הנילון.",
        "ג": "מאחר שמדובר בנושא הנוגע לזכות היסוד של חופש הביטוי אין לוועדת האתיקה סמכות לפתוח\nבבירור משמעתי נגד הנילון.",
        "ד": "לוועדת האתיקה סמכות לפתוח בבירור משמעתי."
      },
      "correct_answer": "ד",
      "reference": "סעיפים ,53 61 לחוק לשכת עורכי הדין, התשכ\"א1961-; על\"ע 1734/00 הועד המחוזי של לשכת עורכי הדין בת\"א-יפו נ 'יורם שפטל",
      "invalidation_note": null
    },
    {
      "stable_id": "2025-06_C_011",
      "number": 11,
      "status": "active",
      "body": "נגד פלוני הוגש כתב אישום המייחס לו עבירה מסוג פשע. במסגרת ההליך הפלילי נגדו טען פלוני כי\nאין להטיל עליו אחריות פלילית למעשה, מאחר שביצע אותו בנסיבות של הגנה עצמית.\nמה הדין?",
      "options": {
        "א": "נקודת המוצא היא שהעבירה נעשתה בתנאים שבהם מתקיים סייג לאחריות פלילית. כלומר על\nהתביעה להוכיח בכל מקרה ומקרה שלא מתקיים סייג כלשהו, גם אם הנאשם לא טוען לכך.",
        "ב": "נקודת המוצא היא שהעבירה נעשתה בתנאים שאין בהם סייג לאחריות פלילית, אולם אם עורר\nהנאשם ספק סביר שמתקיים סייג לאחריות פלילית, והספק לא הוסר, יחול הסייג.",
        "ג": "נקודת המוצא היא שהעבירה נעשתה בתנאים שאין בהם סייג לאחריות פלילית. רק אם הנאשם\nהוכיח ברמה של \"מאזן הסתברויות\" שקיים סייג לאחריות פלילית, יחול הסייג.",
        "ד": "רק במקרים שבהם נטען להתקיימות סייג של הגנה עצמית נקודת המוצא היא שהעבירה נעשתה\nבתנאים שבהם מתקיים הסייג."
      },
      "correct_answer": "ב",